{
  "slug": "state-as-data",
  "status": "closed",
  "text": "Workstream state today lives in markdown. Markdown is a rendering for\nhumans and agents, not a source of truth - it can't be validated, queried,\nor mutated deterministically. Separate the two: state is JSON, validated\nagainst a schema; markdown becomes a view derived from that state.\n\nTooling (the lume CLI) is the only writer of state. An LLM interacts with\nit through deterministic verbs that read and mutate JSON, never by hand-\nediting files. The same tooling lets an agent discover what data exists and\nwhat shape it takes - enumerate entities and surface their schema - so an\nagent dropped cold into a repo can orient without prior knowledge of the\nformat.\n\nEvery read and write is schema-validated. Invalid state is rejected at the\ntooling boundary, not discovered later by a confused reader.\n\nDone-when: workstream/iteration state is stored as schema-validated JSON;\nthe CLI is the sole mutator and exposes verbs to discover entities and\nfetch their schema; JSON is the sole artifact - no markdown views are\ngenerated or required, with human/agent reads served by the discovery\nverbs and in-memory derivation; and this workstream itself is tracked\nunder the new JSON state to prove it.\n\n(Amended 2026-06-10 after reopen: the earlier 'markdown is regenerated\nfrom state' clause is superseded by 'no markdown' - see decisions.)",
  "title": "State is Data"
}
