{
  "slug": "seed-and-numbering",
  "status": "closed",
  "text": "Two related gaps in how lume starts and orders work.\n\n(1) NUMBERING. Iterations are numbered (001, 002, ...) but workstreams are only\nslug-keyed, with no creation-order identity. There is no canonical sequence or\nshort handle for a workstream. Add a sequential, stable number to each\nworkstream alongside its slug - zero-padded to support a large corpus\n(thousands; e.g. 4+ digits) - recorded in schema-validated state and surfaced in\nordered listings. Regular workstreams number from 1; the seed workstream is the\nspecial number 0 (see below). Existing workstreams are assigned numbers by\ncreation order.\n\n(2) SEED. There is no defined entry point when lume meets a repo. The first\nthing should be a 'seed' workstream that builds context - the same discovery we\ndid for lume itself before lume ran any workflows. For a NEW/empty project, seed\nis project discovery (the why/scope/constraints). For an EXISTING repo, seed is\ndiscovery of what the repo already contains. Seed is the canonical bootstrap\nworkstream that turns 'lume dropped into a repo' into a tracked starting point.\nSeed is a SPECIAL workstream and is always number 0 - the zeroth, pre-everything\ncontext-building workstream; regular workstreams begin at 1.\n\nNon-negotiables carried in: schema-validated JSON state (the number is machine\nstate); dependency-free (stdlib only); deterministic (no LLM in any verb/gate);\nbehaviour-preserving for existing workstreams (slug stays a valid handle; they\ngain numbers without breaking); reuse before adding; ceremony buys its cost.\n\nDone-when: every workstream carries a stable sequential number (padded for a\nlarge corpus) alongside its slug, in validated state, with existing workstreams\nmigrated by creation order and listings ordered by it; and a seed bootstrap\nexists (a verb and/or a workstream kind) that, run in a repo, starts a discovery\nworkstream that builds context appropriate to a new project vs an existing repo.\nConcrete shapes - number width + how creation order is determined; whether the\nnumber or slug is the primary handle; whether -w accepts a number; whether seed\nis a `lume seed` verb, a workstream type, or a template; and exactly what seed\ndiscovery captures for new-vs-existing - are discovery/planning decisions.",
  "title": "Seed Workstream & Workstream Numbering"
}
