{
  "slug": "swappable-backing",
  "status": "active",
  "text": "lume's design names three replaceability contracts (scope.md / constraints.md):\nTracking, Review, and Practice. This workstream is about the *Tracking*\ncontract - the persistence of workstream/project-management state (objective,\niterations, plan, decisions, retro, discovery; the lifecycle). Its v1\nimplementation is the local-filesystem `Repository` class; scope.md's example\npair is files -> GitHub Issues / Jira / other PM tools.\n\nToday only the filesystem implementation exists, so the design-for-\nreplaceability claim is proven by tests and design intent, not by lived use\n(logged as a state-as-data carry-forward). `Repository` is also the\nimplementation name, not the contract name, and it conflates 'the PM-state\nstore' with 'the one store' - other aspects of lume (Review, Practice, and\nfuture concerns like inference/config) are separate contracts that may live in\ndifferent stores.\n\nThis workstream builds a real second backing for the Tracking contract and runs\nlume against it, so replaceability is demonstrated, not asserted. Where the\ncontract leaks (assumptions only the filesystem backing satisfies - e.g. engine\ncode that touches files around the seam), the leak is fixed or recorded. The\nfilesystem backing remains the default; the second backing is selectable.\n\nDone-when: a second Tracking backing exists and is exercised by lume's verbs\n(at minimum: resolve/list workstreams, load + save state, the lifecycle\ntransitions); the backing is selected through a documented contract rather than\nby editing engine code; lume's existing behaviour on the filesystem backing is\nunchanged (suite still green); and any contract leaks surfaced are resolved or\nrecorded as decisions. Open for discovery/planning: the concrete second backing\n(real service vs in-process proof), and whether to rename `Repository` to name\nthe Tracking contract it implements.",
  "title": "Swappable Backing (Tracking contract)"
}
