{
  "slug": "agent-friendly-cli",
  "status": "closed",
  "text": "The lume CLI is the agent's interface to the loop - an agent dropped cold into\na repo drives lume entirely through its verbs. MCP (the Model Context Protocol)\nis a successful, widely-adopted standard for exposing capabilities to agents,\nand its structure encodes hard-won principles: capability discovery, typed\nschemas per operation, self-description, predictable verb/argument grammar,\nmachine-parseable I/O, and explicit, structured errors.\n\nlume will NOT adopt MCP or expose an MCP server - that would breach the\ndependency-free / stdlib-only non-negotiable, and lume's interface is a CLI,\nnot a protocol server. The value is in the PRINCIPLES, not the protocol. This\nworkstream investigates how MCP structures an agent-friendly interface,\ndistils the transferable principles, and applies the ones that fit to the lume\nCLI so it is well-structured and genuinely agent-friendly: discoverable,\nself-describing, consistent, and machine-parseable - building on the discovery\nverbs lume already has (entities / schema / get).\n\nNon-negotiables carried in: dependency-free (stdlib only); deterministic over\ninference (no LLM in any verb, gate, or output); reuse before adding; ceremony\nmust buy back its cost.\n\nDone-when: MCP's agent-interface principles are distilled into a concrete,\nlume-specific checklist; the current CLI is assessed against it; and the gaps\nthat matter are closed in the CLI (e.g. consistent verb/flag grammar,\nmachine-readable structured output and errors, complete discovery/schema\ncoverage) - with no new dependency and no LLM in the path. The concrete set of\nprinciples to adopt vs reject, and which CLI changes they imply, is a\ndiscovery/planning decision; discovery may conclude that only a subset is worth\napplying.",
  "title": "Agent-Friendly CLI (MCP-informed)"
}
